{
  "identity": {
    "id": "huggingface:bitbyte/demo-image",
    "source": "huggingface",
    "source_id": "bitbyte/demo-image",
    "canonical_url": "https://huggingface.co/datasets/bitbyte/demo-image",
    "alternate_urls": []
  },
  "content": {
    "title": "Demo Image Classification Dataset",
    "summary": "Small image dataset for classification experiments.",
    "search_text": "demo image classification medical retinopathy",
    "tags": ["image", "classification", "medical"],
    "citation": "BitByte Demo Dataset, 2026"
  },
  "fit": {
    "modalities": ["image"],
    "tasks": ["classification"],
    "domains": ["medical"],
    "targets": ["retinopathy"],
    "languages": [],
    "geography": [],
    "time_range": {
      "start": null,
      "end": null
    },
    "annotation_types": ["image_labels"],
    "attributes": {
      "image": {
        "width": 224,
        "height": 224,
        "channels": 3
      }
    }
  },
  "practical": {
    "size": {
      "bytes": 1200000,
      "records": 1000,
      "features": null
    },
    "splits": {
      "train": true,
      "validation": true,
      "test": true
    },
    "license": {
      "spdx_id": "MIT",
      "label": "MIT",
      "url": "https://spdx.org/licenses/MIT.html",
      "category": "permissive"
    },
    "access_type": "public"
  },
  "quality": {
    "metadata_completeness": 0.9,
    "availability_status": "reachable",
    "warnings": [],
    "last_verified_at": "2026-10-19T00:00:00Z"
  },
  "evidence": {
    "fit.modalities": {
      "evidence_type": "source_metadata",
      "evidence_text": "Image classification dataset",
      "confidence": 0.94
    }
  },
  "provenance": {
    "adapter_version": "huggingface-0.1.0",
    "extracted_at": "2026-10-19T00:00:00Z",
    "source_updated_at": null,
    "schema_version": "0.1.0"
  }
}
